O*NET-SOC Code,Task,Category,Original Task ID,Original Task,Date,Domain Source
49-9045.00,Reline furnaces using ramming material.,New,,,06/2007,Incumbent
49-9052.00,"Set up service for customers, installing, connecting, testing, or adjusting equipment, such as digital subscriber line modems.",Revision,11850.0,"Set up service for customers, installing, connecting, testing, or adjusting equipment.",07/2015,Incumbent
49-9061.00,"Adjust or repair cameras, photographic mechanisms, or equipment such as range and view finders, shutters, light meters, or lens systems, using hand tools.",Revision,8437.0,"Adjust cameras, photographic mechanisms, or equipment such as range and view finders, shutters, light meters, or lens systems, using hand tools.",07/2015,Incumbent
51-2041.00,Troubleshoot and repair electrical or mechanical equipment.,New,,,08/2024,Incumbent
51-3021.00,Clean and sanitize meat cases and cutting equipment.,New,,,07/2016,Incumbent
51-3022.00,Clean meat cutting equipment.,New,,,07/2017,Incumbent
51-4031.00,"Use equipment designed to join sheet metal, such as spot welders.",New,,,07/2015,Incumbent
51-4111.00,Troubleshoot malfunctions in manufacturing equipment.,New,,,08/2021,Incumbent
51-5111.00,Correct color in photographs or digital images.,New,,,07/2016,Incumbent
51-6051.00,"Patch materials, such as cotton or leather.",New,,,08/2024,Incumbent
51-9011.00,Load products into tanks for shipment.,New,,,07/2015,Incumbent
51-9081.00,Meet with dentists or patients to discuss dental appliances.,New,,,08/2022,Incumbent
51-9081.00,Order parts or materials needed to make dental appliances.,New,,,08/2022,Incumbent
51-9081.00,Scan dental models to create digital files.,New,,,08/2022,Incumbent
51-9081.00,Stain porcelain on dental appliances to match the color of patients' teeth.,New,,,08/2022,Incumbent
51-9082.00,Order parts or supplies for orthotic or prosthetic devices.,New,,,07/2015,Incumbent
51-9083.00,Tint lenses according to customer specifications.,New,,,07/2015,Incumbent
51-9151.00,Adjust digital images using software.,New,,,07/2017,Incumbent
51-9162.00,Order tooling for jobs.,New,,,07/2016,Incumbent
51-9195.05,"Apply glazes to pottery pieces, using tools such as spray guns.",Revision,21211.0,"Mix and apply glazes to pottery pieces, using tools, such as spray guns.",08/2020,Incumbent
51-9195.05,Decorate pottery using tools such as brushes.,New,,,08/2020,Incumbent
51-9195.05,Load and unload pottery from kilns.,New,,,08/2020,Incumbent
51-9195.05,Mix chemicals according to recipes to create glazes.,Revision,21211.0,"Mix and apply glazes to pottery pieces, using tools, such as spray guns.",08/2020,Incumbent
53-2021.00,"Monitor, direct, or sequence the movement of aircraft within an assigned air space or on the ground at airports to minimize delays and maximize safety.",Revision,12729.0,Monitor or direct the movement of aircraft within an assigned air space or on the ground at airports to minimize delays and maximize safety.,07/2014,Incumbent
53-2022.00,Inspect airfield conditions to ensure safety and compliance with federal regulatory requirements.,Revision,23939.0,Inspect airfield conditions to ensure compliance with federal regulatory requirements.,08/2021,Incumbent
53-2022.00,Issue notices to advise flight crews of airfield status.,New,,,08/2021,Incumbent
53-2022.00,Train operations staff on topics such as driving on airfields and security identification display area (SIDA) procedures.,Revision,10618.0,Train operations staff.,08/2021,Incumbent
53-7021.00,Inspect crane site conditions to determine ground stability.,New,,,07/2015,Incumbent
53-7031.00,"Perform maintenance on dredge equipment, such as changing engine oil.",New,,,06/2008,Incumbent
53-7062.00,Inspect products for damage or leaks.,New,,,08/2024,Incumbent
